{
  "$schema": "https://json-schema.org/draft/2020-12/schema",
  "title": "Omniforge Worker Manifest",
  "type": "object",
  "required": [
    "id",
    "language",
    "runtime",
    "workerVersion",
    "tier",
    "command",
    "capabilities"
  ],
  "properties": {
    "id": { "type": "string", "minLength": 1 },
    "language": { "type": "string", "minLength": 1 },
    "runtime": { "type": "string", "minLength": 1 },
    "workerVersion": { "type": "string", "minLength": 1 },
    "tier": { "type": "string", "minLength": 1 },
    "workingDirectory": { "type": "string" },
    "command": {
      "type": "array",
      "minItems": 1,
      "items": { "type": "string" }
    },
    "capabilities": {
      "type": "array",
      "minItems": 1,
      "items": {
        "type": "object",
        "required": ["name"],
        "properties": {
          "name": { "type": "string", "minLength": 1 },
          "inputSchema": { "type": "string" },
          "outputSchema": { "type": "string" }
        },
        "additionalProperties": false
      }
    }
  },
  "additionalProperties": true
}
