{
  "id": "findstr-search-01",
  "language": "findstr",
  "runtime": "windows",
  "workerVersion": "0.1.0",
  "tier": "tier-3",
  "workingDirectory": "workers/findstr",
  "command": [
    "powershell",
    "-NoProfile",
    "-ExecutionPolicy",
    "Bypass",
    "-File",
    "worker.ps1"
  ],
  "capabilities": [
    {
      "name": "text.search-findstr",
      "inputSchema": "search-request",
      "outputSchema": "search-response"
    }
  ]
}
