{
  "id": "octave-mean-01",
  "language": "octave",
  "runtime": "11.3.0",
  "workerVersion": "0.1.0",
  "tier": "tier-3",
  "workingDirectory": "workers/octave",
  "command": [
    "powershell",
    "-NoProfile",
    "-ExecutionPolicy",
    "Bypass",
    "-File",
    "worker.ps1"
  ],
  "capabilities": [
    {
      "name": "math.mean",
      "inputSchema": "number-list-request",
      "outputSchema": "mean-result"
    }
  ]
}
