{
  "id": "gleam-lower-01",
  "language": "gleam",
  "runtime": "1.17.0",
  "workerVersion": "0.1.0",
  "tier": "tier-1",
  "workingDirectory": "workers/gleam",
  "command": [
    "cmd",
    "/q",
    "/c",
    "worker.cmd"
  ],
  "capabilities": [
    {
      "name": "text.lower-gleam",
      "inputSchema": "text-request",
      "outputSchema": "lowercase-result"
    }
  ]
}
