{
  "id": "protobuf-descriptor-01",
  "language": "protobuf",
  "runtime": "protoc-33.0",
  "workerVersion": "0.1.0",
  "tier": "tier-3",
  "workingDirectory": "workers/protobuf",
  "command": [
    "powershell",
    "-ExecutionPolicy",
    "Bypass",
    "-File",
    "worker.ps1"
  ],
  "capabilities": [
    {
      "name": "dev.proto-descriptor",
      "inputSchema": "proto-descriptor-request",
      "outputSchema": "proto-descriptor-result"
    },
    {
      "name": "ops.incident-packet",
      "inputSchema": "remediation-summary",
      "outputSchema": "incident-packet"
    }
  ]
}
