{
  "id": "janet-lower-01",
  "language": "janet",
  "runtime": "1.41.2",
  "workerVersion": "0.1.0",
  "tier": "tier-3",
  "workingDirectory": "workers/janet",
  "command": [
    "powershell",
    "-NoProfile",
    "-ExecutionPolicy",
    "Bypass",
    "-File",
    "worker.ps1"
  ],
  "capabilities": [
    {
      "name": "text.lower-janet",
      "inputSchema": "text-request",
      "outputSchema": "lowercase-result"
    }
  ]
}
